220,tricep kickback kneeling both arms,MVP,1260,17,1.71%,88.24%,94.12%,1,0.1764705882,99.42%,170,67.42%,1.77%,-0.53%,0
221,tricep kickback standing alternating with resting arm down,MVP,1270,12,8.52%,50.00%,75.00%,1,-0.5,99.93%,118,82.54%,-0.07%,-1.57%,0
222,tricep kickback standing alternating with resting arm up,List A,1269,10,19.07%,20.00%,50.00%,0,-1.3,99.84%,99,73.32%,-0.16%,3.82%,0
223,tricep kickback standing both arms,MVP,1267,16,6.51%,75.00%,87.50%,1,-0.3125,99.60%,181,72.35%,-0.30%,3.86%,1
224,tricep kickback standing single arm with resting arm down,MVP,1268,20,9.25%,70.00%,80.00%,1,0.45,99.63%,393,79.35%,-0.21%,1.79%,0
225,tuck jump consecutive,List A,1076,17,66.26%,0.00%,11.76%,0,-13.11764706,56.01%,360,2.14%,-35.84%,16.74%,0
226,tuck jump with pause,List A,1077,17,47.62%,5.88%,35.29%,0,-5.588235294,46.34%,192,7.19%,-42.50%,30.08%,0
227,tuck up arms overhead,MVP,1124,18,14.81%,61.11%,72.22%,0,-0.7777777778,82.10%,160,83.18%,0.04%,-0.35%,0
228,tuck up assisted,MVP,1730,11,4.82%,63.64%,90.91%,1,0,97.31%,121,79.77%,-0.57%,2.48%,0
229,tuck up both legs arms by side,MVP,1123,5,1.82%,80.00%,100.00%,1,-0.2,98.77%,51,83.34%,-0.49%,1.82%,0
230,tuck up hands grab feet,MVP,1126,16,6.08%,75.00%,87.50%,1,0.125,94.83%,149,89.88%,0.57%,3.79%,0
231,tuck up hands grab knees,MVP,1125,19,5.41%,73.68%,89.47%,1,-0.1052631579,95.19%,174,76.83%,-1.33%,-0.72%,0
232,turkish getup alternating,List A,1127,10,1.11%,90.00%,100.00%,1,-0.1,97.66%,52,67.23%,-1.45%,0.00%,0
233,turkish getup same side,List A,1128,12,5.83%,83.33%,91.67%,1,0.4166666667,93.84%,76,67.72%,-1.44%,-0.83%,0
234,v up arms by side,MVP,1129,14,4.16%,64.29%,92.86%,1,-0.1428571429,95.71%,138,78.42%,-0.95%,2.08%,0
235,v up arms overhead,MVP,1130,20,4.78%,70.00%,95.00%,1,-0.05,94.66%,182,75.60%,-1.06%,-0.10%,0
236,v up assisted,MVP,1131,15,7.48%,40.00%,93.33%,1,-0.1333333333,97.62%,153,71.61%,-1.61%,2.53%,0
237,wide grip bent over row alternating with resting arm down,MVP,1721,6,10.52%,33.33%,50.00%,0,0.3333333333,100.00%,76,54.01%,3.91%,-0.40%,0
238,wide grip bent over row alternating with resting arm up,List A,1718,8,25.02%,0.00%,12.50%,0,-1.5,99.90%,118,43.30%,-0.04%,16.36%,0
239,wide grip bent over row both arms,MVP,1719,6,0.00%,100.00%,100.00%,1,0,99.94%,67,96.25%,-0.06%,0.00%,0
240,wide grip chest press hook lying both arms,MVP,1523,4,4.01%,50.00%,100.00%,1,0.5,99.55%,51,83.52%,-0.36%,1.92%,0
241,wide grip chest press table top both arms,MVP,1527,4,4.01%,50.00%,100.00%,1,0.5,99.28%,50,35.68%,-0.72%,-8.01%,0
242,wood chop kneeling alternating,MVP,1136,10,5.89%,20.00%,100.00%,1,0.6,100.00%,144,97.13%,0.96%,4.89%,0
243,wood chop kneeling single side,MVP,1133,5,3.05%,40.00%,100.00%,1,0.6,99.75%,100,96.21%,-0.19%,2.00%,0
244,wood chop one knee,MVP,1140,12,9.82%,25.00%,58.33%,1,0.4166666667,98.75%,243,94.71%,1.85%,3.43%,0
245,wood chop sitting alternating,MVP,1135,11,13.08%,27.27%,81.82%,0,1,100.00%,144,95.10%,0.04%,4.52%,0
246,wood chop sitting single side,MVP,1134,5,3.11%,40.00%,100.00%,1,0.6,100.00%,99,95.92%,0.00%,0.89%,0
247,wood chop standing alternating,MVP,1137,10,8.03%,30.00%,80.00%,1,0.6,99.97%,134,96.90%,0.04%,5.10%,0
248,wood chop standing single side,MVP,1315,9,3.61%,44.44%,100.00%,1,0.3333333333,98.16%,154,96.32%,-1.36%,2.41%,0
249,zottman curl balancing alternating with resting arm down,MVP,1291,8,0.00%,100.00%,100.00%,1,0,98.91%,82,98.03%,1.41%,0.00%,0
250,zottman curl kneeling both arms,MVP,1279,13,5.43%,61.54%,84.62%,1,0.3846153846,97.92%,131,87.67%,-1.28%,3.80%,0
251,zottman curl standing alternating with resting arm down,MVP,1287,8,0.00%,100.00%,100.00%,1,0,99.66%,77,97.42%,1.15%,0.00%,0
252,zottman curl standing alternating with resting arm up,List A,1281,8,8.75%,25.00%,87.50%,1,0.875,100.00%,78,93.72%,0.04%,-5.63%,0
253,zottman curl standing both arms,MVP,1282,12,5.83%,83.33%,83.33%,1,-0.5833333333,97.27%,110,98.65%,0.04%,0.00%,0
,,,,,,,,,,,,,,,
,Avg,,,,8.61%,61.30%,82.60%,,,95.70%,,76.00%,-1.49%,2.14%,