,variation,release_group,exercise_id,n_sets,MARE,OBZ,OB1,EC,rep_error_bias,is_FA,n_total_reps,signal_score,FA Delta With V7,MARE Delta With V7,Clip Delta
0,alternating lunge jumps with both arms swinging,List A,613,17,3.88%,64.71%,94.12%,1,0.05882352941,98.00%,181,71.48%,-0.26%,-2.46%,0
1,alternating lunge jumps with runner arms,List A,612,15,12.50%,40.00%,66.67%,0,-0.4666666667,99.84%,204,60.60%,2.45%,2.76%,0
2,bent over row kneeling alternating with resting arm down,MVP,620,6,16.88%,16.67%,50.00%,0,1.666666667,98.82%,95,51.92%,0.09%,9.13%,0
3,bent over row kneeling both arms,MVP,618,7,10.18%,42.86%,85.71%,0,0.5714285714,99.67%,86,75.57%,-0.25%,7.89%,0
4,bent over row standing alternating with resting arm down,MVP,614,8,8.82%,37.50%,75.00%,1,-0.25,99.24%,108,58.73%,-0.30%,1.36%,0
5,bent over row standing alternating with resting arm up,List A,615,4,40.21%,0.00%,0.00%,0,-6,100.00%,60,56.94%,0.11%,22.76%,0
6,bent over row standing both arms,MVP,616,9,1.85%,88.89%,88.89%,1,0.2222222222,99.25%,90,92.17%,-0.62%,1.85%,0
7,bent over row standing single arm,MVP,619,6,14.62%,16.67%,33.33%,0,0.1666666667,98.70%,112,42.43%,1.35%,1.67%,0
8,bicep curl balancing left alternating with resting arm down,MVP,629,8,3.78%,62.50%,100.00%,1,0.125,98.93%,82,82.70%,-0.52%,2.53%,0
9,bicep curl balancing left single arm,MVP,637,6,4.17%,33.33%,66.67%,1,0.3333333333,98.13%,148,89.43%,0.96%,-2.08%,0
10,bicep curl balancing right both arms,MVP,632,9,1.11%,88.89%,100.00%,1,0.1111111111,98.78%,92,94.83%,-0.13%,0.00%,0
11,bicep curl kneeling alternating with resting arm down,MVP,643,10,8.91%,60.00%,90.00%,1,0.7,97.84%,110,55.72%,3.79%,5.38%,0
12,bicep curl kneeling with both arms,MVP,645,12,2.42%,75.00%,100.00%,1,0.25,98.54%,111,81.33%,3.32%,1.52%,1
13,bicep curl kneeling with single arm,MVP,647,6,8.53%,50.00%,66.67%,1,1.5,99.55%,115,75.65%,0.11%,5.36%,0
14,bicep curl kneeling with single arm with resting arm half up,List A,648,7,13.38%,28.57%,57.14%,0,-1.857142857,98.33%,144,66.67%,-0.07%,2.66%,0
15,bicep curl standing alternating with resting arm down,MVP,657,9,0.93%,88.89%,100.00%,1,-0.1111111111,97.66%,99,87.39%,-0.42%,-4.71%,0
16,bicep curl standing alternating with resting arm up,List A,652,9,23.09%,0.00%,44.44%,0,-1,100.00%,90,59.55%,0.21%,9.63%,0
17,bicep curl standing with both arms,MVP,653,19,7.25%,78.95%,94.74%,1,-0.5263157895,99.18%,188,89.59%,0.05%,0.93%,0
18,bicep curl standing with single arm,MVP,655,10,2.00%,60.00%,100.00%,1,0.2,99.94%,183,94.09%,0.41%,0.53%,0
19,bird dog opposite arm and leg knee to elbow,List A,1024,14,19.76%,21.43%,50.00%,0,0.4285714286,98.81%,249,89.70%,-0.55%,-0.36%,0
20,bird dog opposite arm and leg rep,List A,1025,7,0.00%,100.00%,100.00%,1,0,98.52%,99,75.98%,-0.31%,-1.59%,0
21,bodyweight squat 1.5 squat,List A,572,12,52.99%,0.00%,8.33%,0,4.25,93.57%,125,89.42%,-0.02%,18.27%,0
22,bodyweight squat arms by side,MVP,575,6,4.34%,50.00%,100.00%,1,0.5,95.57%,82,55.40%,0.57%,2.67%,0
23,bodyweight squat arms overhead,MVP,573,7,2.62%,71.43%,100.00%,1,0.2857142857,99.17%,68,32.23%,-0.54%,2.62%,0
24,bodyweight squat arms straight out,MVP,574,4,0.00%,100.00%,100.00%,1,0,99.50%,38,26.90%,0.92%,-2.50%,0
25,bodyweight squat arms swinging,MVP,576,5,6.97%,20.00%,100.00%,1,0.4,93.55%,57,68.62%,-0.89%,5.15%,0
26,bodyweight squat hands at shoulders,MVP,329,19,1.68%,84.21%,94.74%,1,-0.1052631579,98.51%,201,72.47%,-0.52%,-0.24%,0
27,bodyweight squat hands centered,MVP,577,19,2.21%,78.95%,100.00%,1,0.2105263158,94.44%,194,82.76%,-0.70%,1.68%,0
28,bodyweight squat hands on head,MVP,578,13,2.31%,84.62%,92.31%,1,-0.2307692308,98.30%,128,78.82%,0.15%,0.00%,0
29,bodyweight sumo squat 1.5 squat,List A,1628,3,30.30%,33.33%,33.33%,0,3.333333333,99.95%,34,87.58%,0.78%,9.34%,0
30,bodyweight sumo squat arms overhead,MVP,1629,5,23.09%,60.00%,60.00%,0,-2.4,83.03%,51,81.75%,-5.13%,2.00%,0
31,bodyweight sumo squat arms straight out,MVP,1630,5,1.82%,80.00%,100.00%,1,0.2,99.09%,55,63.01%,0.54%,0.00%,0
32,bodyweight sumo squat arms swinging,MVP,1631,5,1.82%,80.00%,100.00%,1,-0.2,94.82%,56,69.70%,-0.72%,-1.82%,0
33,bodyweight sumo squat hands centered,MVP,1632,5,4.00%,80.00%,80.00%,1,0.4,94.59%,50,58.65%,-3.73%,2.00%,0
34,bodyweight sumo squat hands on head,MVP,1633,5,13.64%,60.00%,60.00%,0,-0.6,96.35%,52,30.30%,1.64%,-6.00%,0
35,bridging clamshells,List A,543,6,16.67%,66.67%,83.33%,0,0.6666666667,99.87%,41,66.61%,-0.13%,16.67%,0
36,broad jump with back pedal,List A,1035,17,21.33%,41.18%,76.47%,0,2.941176471,95.37%,212,54.08%,-4.57%,10.48%,0
37,broad jump with jump back,List A,1037,7,42.69%,14.29%,42.86%,0,1.571428571,97.11%,51,40.35%,0.52%,19.64%,0
38,burpee chest to the ground,MVP,664,18,2.31%,88.89%,100.00%,1,0,92.60%,98,81.51%,-1.41%,-1.39%,0
39,burpee from plank,MVP,665,14,11.47%,57.14%,92.86%,0,-0.5714285714,93.09%,76,52.42%,-1.22%,2.98%,0
40,burpee with pushup,MVP,666,17,14.12%,70.59%,82.35%,0,-1.647058824,94.27%,109,71.57%,-1.05%,2.75%,0
41,chest fly standing both arms,MVP,1050,8,0.00%,100.00%,100.00%,1,0,94.70%,81,97.21%,-4.42%,-4.48%,0
42,chest fly standing staggered both arms,MVP,1051,12,5.09%,41.67%,100.00%,1,-0.25,91.95%,138,96.72%,-7.33%,-0.45%,0
43,clamshells from laying,List A,587,17,8.88%,58.82%,88.24%,1,-0.8823529412,99.87%,201,51.16%,1.00%,1.85%,0
44,clean both arms hang,List A,1058,20,6.57%,50.00%,95.00%,1,0.6,95.43%,193,86.64%,-2.90%,-0.98%,1
45,clean single arm alternating,List A,1060,16,13.64%,81.25%,81.25%,0,1.375,97.04%,160,87.97%,-1.37%,2.10%,0
46,concentrated curl kneeling lunge,List A,1030,18,9.07%,33.33%,72.22%,1,0.3888888889,91.98%,183,68.37%,-0.82%,1.30%,0
47,cross body curl kneeling alternating with resting arm down,MVP,588,16,7.44%,81.25%,93.75%,1,-0.8125,86.22%,169,86.02%,-10.89%,3.81%,0
48,cross body curl standing alternating with resting arm down,MVP,592,16,12.50%,87.50%,87.50%,0,-1.375,84.37%,160,82.11%,-13.64%,9.83%,1
49,cross body curl standing single arm with resting arm down,MVP,593,10,9.72%,70.00%,90.00%,1,-2,92.23%,196,94.03%,-5.40%,-0.97%,0
50,crunch arms above you,List A,1082,18,15.87%,55.56%,61.11%,0,-0.8333333333,98.35%,195,51.49%,-1.46%,3.27%,1
51,crunch arms overhead,List A,1081,16,5.57%,68.75%,93.75%,1,0.25,99.15%,158,59.43%,0.70%,2.14%,0
52,crunch table top,List A,1083,18,11.89%,38.89%,72.22%,0,-0.05555555556,99.75%,191,38.28%,0.03%,7.40%,2
53,deadlift arms by side,MVP,671,15,7.04%,80.00%,86.67%,1,-0.6666666667,88.48%,143,82.03%,-2.54%,0.67%,0
54,deadlift arms straight out,MVP,672,15,5.41%,80.00%,93.33%,1,-0.2666666667,94.97%,144,84.43%,0.71%,0.74%,0
55,deadlift hands on hips,MVP,673,15,4.74%,86.67%,93.33%,1,-0.3333333333,94.53%,151,84.68%,2.07%,0.74%,0
56,deadlift romanian,MVP,675,10,3.22%,80.00%,90.00%,1,0.4,94.31%,98,91.12%,2.90%,3.22%,0
57,deadlift single dumbbell,MVP,676,9,11.13%,33.33%,77.78%,0,-1,97.08%,128,81.86%,6.47%,3.15%,0
58,deadlift suitcase,MVP,677,7,9.09%,85.71%,85.71%,1,-1,97.69%,72,85.88%,5.07%,0.00%,0
59,dumbbell pass through on knees,List A,1141,17,13.43%,35.29%,58.82%,0,0.3529411765,96.89%,174,47.50%,-1.78%,1.83%,0
60,dumbbell pass through on toes,List A,1142,19,14.31%,36.84%,78.95%,0,-0.7894736842,90.58%,190,57.87%,-7.55%,-3.76%,1
61,dumbbell push up on knees,MVP,1530,5,12.38%,60.00%,60.00%,0,1,98.43%,44,74.33%,-0.49%,6.67%,0
62,dumbbell push up on toes,MVP,1529,4,0.00%,100.00%,100.00%,1,0,98.27%,40,75.26%,-0.15%,-2.50%,0
63,dumbbell swing alternating single arm passing dumbbell,List A,679,16,19.77%,18.75%,62.50%,0,-2.0625,88.14%,178,63.75%,-10.33%,11.71%,0
64,dumbbell swing both arms single dumbbell,List A,681,19,12.27%,26.32%,78.95%,0,-0.5263157895,89.66%,201,81.78%,-6.11%,5.70%,1
65,dumbbell swing suitcase,List A,687,10,2.67%,70.00%,100.00%,1,-0.3,89.55%,107,90.63%,-4.20%,-0.33%,0
66,dumbbell thruster alternating,MVP,689,14,12.44%,57.14%,71.43%,0,-1.214285714,95.46%,168,97.00%,-1.21%,0.00%,0
67,dumbbell thruster classic,MVP,688,13,0.00%,100.00%,100.00%,1,0,95.23%,131,97.52%,-1.31%,-0.83%,1
68,dumbbell thruster to rotational press both arms,MVP,691,10,1.00%,90.00%,100.00%,1,0.1,95.06%,99,94.91%,-2.72%,-1.00%,0
69,french doors kneeling alternating with resting arm in,MVP,1319,12,7.29%,50.00%,91.67%,1,-0.5833333333,94.45%,123,53.20%,-2.71%,-3.26%,0
70,french doors kneeling both arms,MVP,1145,10,0.00%,100.00%,100.00%,1,0,95.09%,101,65.45%,-3.66%,-6.85%,0
71,french doors standing alternating with resting arm in,MVP,1320,20,9.24%,65.00%,75.00%,1,-0.8,97.47%,198,63.15%,-1.10%,-0.85%,0
72,french doors standing both arms,MVP,1148,19,0.84%,89.47%,100.00%,1,-0.1052631579,97.69%,204,78.14%,-1.43%,-2.55%,0
73,french doors standing single arm,MVP,1149,14,0.78%,85.71%,100.00%,1,-0.1428571429,98.18%,245,76.69%,-0.62%,-2.90%,0
74,front lunge arms by side,MVP,700,6,7.78%,50.00%,83.33%,1,-0.5,94.37%,64,32.12%,-2.45%,5.19%,0
75,front lunge arms out laterally,MVP,704,7,5.45%,71.43%,71.43%,1,0,97.45%,73,30.84%,-0.70%,4.03%,0
76,front lunge arms overhead,MVP,702,8,16.25%,50.00%,62.50%,0,0.375,95.65%,80,53.54%,-2.19%,10.00%,0
77,front lunge arms straight out,MVP,701,12,8.33%,41.67%,83.33%,1,-0.3333333333,88.06%,120,71.51%,-1.99%,5.90%,0
78,front lunge hands on hips,MVP,705,8,2.50%,75.00%,100.00%,1,-0.25,87.77%,79,66.46%,-8.01%,1.11%,0
79,front lunge runner arms,MVP,707,14,9.64%,50.00%,78.57%,1,-0.8571428571,95.29%,151,76.85%,-2.48%,6.71%,0
80,front lunge weights hanging,MVP,708,14,2.10%,78.57%,100.00%,1,-0.07142857143,93.99%,139,84.47%,-3.74%,1.39%,0
81,front lunge weights racked,MVP,710,12,4.17%,75.00%,83.33%,1,-0.4166666667,96.33%,119,88.29%,-2.55%,2.50%,0
82,front lunge with curl,List A,706,10,16.77%,70.00%,80.00%,0,-0.3,92.48%,105,78.23%,-2.72%,6.77%,0
83,front raise kneeling alternating with resting arm down,MVP,716,5,0.00%,100.00%,100.00%,1,0,95.21%,50,85.54%,-3.88%,0.00%,0
84,front raise kneeling both arms,MVP,718,10,3.43%,70.00%,90.00%,1,-0.2,94.86%,104,97.15%,-3.88%,2.43%,0
85,front raise kneeling single arm with resting arm down,MVP,719,12,3.61%,41.67%,91.67%,1,0.1666666667,95.89%,220,81.77%,-0.74%,-2.88%,0
86,front raise standing alternating with resting arm down,MVP,731,16,2.85%,68.75%,100.00%,1,-0.1875,95.34%,167,92.11%,-2.06%,1.88%,0
87,front raise standing alternating with resting arm up,List A,728,12,14.17%,16.67%,58.33%,0,-0.25,97.42%,121,84.65%,-2.22%,5.00%,0
88,front raise standing both arms,MVP,729,15,1.33%,86.67%,100.00%,1,-0.1333333333,97.55%,142,97.93%,-1.05%,0.00%,0
89,front raise standing single arm with resting arm down,MVP,730,11,7.30%,72.73%,90.91%,1,-1.090909091,97.74%,209,92.36%,-0.77%,-1.34%,0
90,front raise standing single arm with resting arm up,List A,727,12,17.92%,33.33%,58.33%,0,2,95.06%,173,85.60%,0.27%,-0.06%,0
91,front to back lunge arms by side,List A,1164,6,5.56%,83.33%,83.33%,1,-0.6666666667,94.17%,66,47.51%,-0.33%,-6.35%,0
92,front to back lunge weights hanging,List A,1169,16,14.91%,50.00%,62.50%,0,-1.375,89.84%,261,64.41%,-5.88%,8.23%,0
93,front to back lunge with rotation,List A,1163,11,17.83%,27.27%,63.64%,0,-1.454545455,91.75%,166,88.72%,-5.15%,-5.48%,0
94,hand release pushup on knees,List A,304,15,2.36%,80.00%,100.00%,1,0.2,95.24%,115,93.41%,-0.66%,-1.19%,1
95,hand release pushup on knees arms extended,List A,1503,6,14.75%,66.67%,83.33%,0,-1.333333333,96.38%,66,80.33%,-2.00%,0.00%,0
96,hand release pushup on toes,List A,594,12,1.67%,91.67%,100.00%,1,0.08333333333,94.76%,61,92.74%,-2.23%,-0.33%,2
97,hand release pushup on toes arms extended,List A,1502,5,20.00%,60.00%,60.00%,0,-2.2,97.42%,54,90.60%,-1.34%,3.33%,0
98,hip bridge repping hands bent at 90,List A,599,19,5.26%,94.74%,94.74%,1,-0.5789473684,100.00%,199,78.92%,0.00%,0.00%,0
99,lateral lunge alternating single dumbbell,MVP,749,15,3.41%,66.67%,100.00%,1,-0.06666666667,94.31%,150,91.75%,-1.71%,-3.87%,0
100,lateral lunge arms by side,MVP,740,20,3.63%,85.00%,90.00%,1,-0.3,90.98%,196,90.21%,3.39%,1.63%,0
101,lateral lunge arms by side dumbbell,MVP,750,11,9.14%,54.55%,81.82%,1,-0.7272727273,89.89%,104,93.72%,-1.26%,4.39%,0
102,lateral lunge arms straight out,MVP,737,7,1.43%,85.71%,100.00%,1,0.1428571429,88.18%,70,70.23%,-1.15%,-2.86%,0
103,lateral lunge hands on head,MVP,738,6,1.67%,83.33%,100.00%,1,-0.1666666667,94.68%,59,70.96%,-0.46%,1.67%,0
104,lateral lunge hands on hips,MVP,739,11,12.60%,63.64%,81.82%,0,-0.09090909091,90.28%,101,84.77%,0.39%,3.51%,0
105,lateral lunge left,MVP,319,8,4.03%,62.50%,100.00%,1,-0.375,92.26%,62,78.78%,3.04%,-1.79%,0
106,lateral lunge swing to arms overhead,MVP,746,8,4.89%,50.00%,100.00%,1,0.25,92.32%,82,96.21%,-0.70%,1.25%,0
107,lateral lunge weights racked,MVP,751,18,3.95%,72.22%,88.89%,1,-0.2777777778,98.83%,179,62.29%,-0.15%,1.16%,0
108,lateral lunge with runners arms,MVP,744,8,1.25%,87.50%,100.00%,1,-0.125,96.15%,89,78.15%,4.46%,1.25%,0
109,lateral raise kneeling alternating with resting arm down,MVP,770,3,1.75%,66.67%,100.00%,1,0.3333333333,78.87%,37,91.11%,-16.77%,-4.17%,0
110,lateral raise kneeling both arms,MVP,772,6,0.00%,100.00%,100.00%,1,0,92.73%,54,93.13%,-5.41%,0.00%,0
111,lateral raise kneeling eccentric,MVP,769,7,4.76%,85.71%,85.71%,1,-0.2857142857,96.26%,66,96.16%,-2.51%,0.00%,0
112,lateral raise kneeling lunge left alternating with resting arm down,MVP,757,12,0.93%,91.67%,100.00%,1,0.08333333333,99.39%,121,93.52%,-0.09%,-0.12%,0
113,lateral raise kneeling lunge left single arm with resting arm down,MVP,756,13,3.89%,69.23%,84.62%,1,0.3846153846,96.74%,205,82.48%,-2.88%,3.50%,0
114,lateral raise kneeling lunge right both arms,MVP,765,14,0.00%,100.00%,100.00%,1,0,97.81%,138,97.09%,-2.10%,0.00%,0
115,lateral raise kneeling single arm with resting arm down,MVP,773,6,8.71%,66.67%,66.67%,1,-1.333333333,86.45%,89,91.92%,-12.26%,8.71%,0
116,lateral raise standing alternating with resting arm down,MVP,780,8,0.00%,100.00%,100.00%,1,0,94.46%,78,92.70%,-2.24%,0.00%,0
117,lateral raise standing both arms,MVP,778,16,0.00%,100.00%,100.00%,1,0,98.38%,161,96.82%,-0.16%,0.00%,0
118,lateral raise standing eccentric,MVP,775,7,1.43%,85.71%,100.00%,1,0.1428571429,99.08%,75,96.98%,0.07%,0.00%,0
119,lateral raise standing single arm with resting arm down,MVP,779,6,3.33%,50.00%,100.00%,1,0.1666666667,97.52%,96,87.28%,-0.97%,0.83%,0
120,neutral grip chest press hook lying both arms,MVP,1212,19,13.31%,68.42%,78.95%,0,-0.3684210526,93.34%,202,75.32%,-6.48%,6.93%,0
121,neutral grip chest press table top alternating with resting arm up,List A,1228,11,12.98%,36.36%,72.73%,0,-0.09090909091,99.41%,114,77.69%,-0.59%,1.57%,0
122,neutral grip chest press table top both arms,MVP,1229,8,0.00%,100.00%,100.00%,1,0,99.87%,80,75.44%,-0.13%,0.00%,0
123,overhead extension kneeling both arms,MVP,805,16,10.30%,37.50%,75.00%,0,0.3125,99.54%,170,70.01%,-0.16%,4.42%,0
124,overhead extension kneeling lunge right one dumbbell,MVP,787,18,11.26%,33.33%,77.78%,0,0.7222222222,99.69%,186,70.86%,-0.29%,1.16%,0
125,overhead extension kneeling one dumbbell,MVP,786,9,10.56%,11.11%,88.89%,0,-0.1111111111,100.00%,113,57.51%,0.00%,4.94%,0
126,overhead extension kneeling right lunge both arms,MVP,799,19,7.75%,63.16%,89.47%,1,0.4736842105,98.84%,186,75.55%,-0.49%,1.04%,0
127,overhead extension kneeling single arm with resting arm down,MVP,802,18,3.69%,72.22%,88.89%,1,-0.05555555556,99.65%,262,75.21%,-0.16%,-1.00%,0
128,overhead extension standing alternating with resting arm down,MVP,812,6,6.78%,50.00%,83.33%,1,0,98.60%,55,82.12%,-0.19%,-5.54%,0
129,overhead extension standing both arms,MVP,810,10,11.38%,50.00%,70.00%,0,0.2,98.54%,101,66.14%,-0.51%,-0.18%,0
130,overhead extension standing one dumbbell,MVP,807,19,20.93%,47.37%,68.42%,0,-0.5263157895,99.20%,197,47.24%,0.16%,3.62%,1
131,overhead extension standing single arm,MVP,811,19,6.60%,26.32%,68.42%,1,0.6315789474,97.88%,307,82.19%,0.99%,0.97%,0
132,overhead press kneeling alternating resting arm down,MVP,831,18,2.68%,77.78%,94.44%,1,-0.05555555556,98.24%,184,96.63%,0.05%,1.57%,0
133,overhead press kneeling both arms,MVP,835,18,3.64%,72.22%,94.44%,1,0.05555555556,97.60%,192,92.33%,1.03%,2.21%,0
134,overhead press kneeling single arm,List A,836,19,17.32%,26.32%,68.42%,0,-1.157894737,93.21%,369,83.30%,-4.19%,5.43%,1
135,overhead press kneeling single arm with resting arm down,MVP,832,20,6.11%,60.00%,85.00%,1,0.1,94.52%,198,85.05%,-3.27%,0.50%,0
136,overhead press standing alternating with resting arm down,MVP,841,20,5.84%,65.00%,90.00%,1,-0.35,96.27%,197,85.11%,0.28%,2.50%,0
137,overhead press standing alternating with resting arm up,List A,837,19,10.96%,26.32%,89.47%,0,0.1578947368,98.65%,198,83.39%,1.41%,-2.63%,0
138,overhead press standing both arms,MVP,839,19,1.64%,84.21%,100.00%,1,0.05263157895,96.79%,179,92.60%,0.56%,-0.58%,0
139,overhead press standing single arm,MVP,840,20,1.71%,70.00%,95.00%,1,0.35,97.86%,401,95.14%,0.22%,0.22%,0
140,overhead press standing single arm with resting arm down,MVP,842,19,4.74%,63.16%,94.74%,1,0.3684210526,96.15%,190,94.82%,1.51%,1.58%,0
141,overhead press wide kneeling alternating resting arm down,MVP,1498,5,3.33%,80.00%,80.00%,1,-0.4,92.83%,60,91.50%,-7.17%,3.33%,0
142,overhead press wide kneeling both arms,MVP,1500,5,10.00%,60.00%,60.00%,0,1,99.48%,50,48.64%,1.03%,8.00%,0
143,overhead press wide kneeling single arm,MVP,1501,5,0.00%,100.00%,100.00%,1,0,94.60%,30,89.46%,-5.40%,-3.33%,0
144,overhead press wide standing alternating with resting arm down,MVP,1493,8,2.08%,75.00%,100.00%,1,0,100.00%,96,91.28%,0.77%,2.08%,0
145,overhead press wide standing both arms,MVP,1495,3,0.00%,100.00%,100.00%,1,0,99.17%,30,80.49%,0.17%,-3.33%,0
146,overhead press wide standing single arm with resting arm down,MVP,1497,5,0.00%,100.00%,100.00%,1,0,98.99%,32,76.59%,0.21%,0.00%,0
147,pike pushup on knees,List A,335,15,2.67%,86.67%,93.33%,1,-0.2666666667,99.78%,133,69.05%,0.00%,0.00%,0
148,pike pushup on toes,List A,851,13,0.00%,100.00%,100.00%,1,0,100.00%,117,64.79%,0.00%,-1.54%,0
149,punches alternating heels planted,List A,1084,11,17.49%,36.36%,63.64%,0,-2,88.92%,146,71.62%,-7.96%,-1.49%,0
150,push press single arm,List A,1242,13,6.86%,46.15%,69.23%,1,0.07692307692,88.22%,218,95.90%,-8.64%,3.46%,1
151,push press standing both arms,List A,1241,20,14.72%,60.00%,70.00%,0,-0.5,84.44%,185,93.35%,-12.44%,11.67%,0
152,pushup jack at bottom,List A,963,14,12.74%,71.43%,85.71%,0,-0.4285714286,88.62%,77,83.55%,-5.93%,10.06%,0
153,pushup on knees,MVP,328,15,6.51%,80.00%,93.33%,1,-1.066666667,98.46%,180,84.75%,-0.63%,-0.89%,0
154,pushup on toes,MVP,856,11,4.80%,63.64%,81.82%,1,0.2727272727,94.29%,100,79.96%,5.40%,-3.55%,-2
155,reverse fly on knees both arms,MVP,1253,19,8.48%,68.42%,73.68%,1,0.3684210526,96.35%,198,71.77%,-2.29%,2.26%,1
156,reverse fly split stance both arms,MVP,1256,14,8.27%,28.57%,57.14%,1,1.5,94.65%,248,75.37%,-0.57%,3.52%,0
157,reverse fly standing bent over alternating,MVP,1251,11,10.73%,36.36%,72.73%,0,0.8181818182,94.87%,128,61.49%,-3.57%,-6.64%,0
158,reverse fly standing bent over both arms,MVP,1250,18,12.02%,61.11%,77.78%,0,0.8888888889,99.57%,194,72.37%,0.02%,10.35%,0
159,reverse lunge alternating,MVP,871,10,1.43%,90.00%,100.00%,1,0.1,97.74%,119,89.33%,0.21%,1.43%,0
160,reverse lunge alternating single dumbbell pass through,List A,872,7,1.43%,85.71%,100.00%,1,-0.1428571429,96.48%,77,92.75%,0.03%,0.33%,0
161,reverse lunge arms by side,MVP,881,18,7.86%,72.22%,77.78%,1,-0.8888888889,95.32%,197,77.52%,-1.63%,1.21%,0
162,reverse lunge arms by side dumbbell,MVP,890,13,2.65%,76.92%,92.31%,1,0.2307692308,96.76%,144,81.98%,-2.10%,-2.01%,0
163,reverse lunge arms overhead,MVP,883,19,5.45%,63.16%,89.47%,1,0.1578947368,99.01%,209,82.23%,0.86%,4.40%,0
164,reverse lunge arms overhead dumbbell,MVP,891,5,2.00%,80.00%,100.00%,1,-0.2,98.35%,52,88.76%,-0.16%,2.00%,0
165,reverse lunge arms straight out,MVP,882,20,2.18%,75.00%,100.00%,1,-0.15,98.35%,220,78.93%,0.91%,-0.42%,0
166,reverse lunge hands on hips,MVP,884,17,5.51%,70.59%,76.47%,1,-0.5882352941,95.89%,185,65.75%,-1.87%,-0.54%,0
167,reverse lunge offset,MVP,877,5,1.82%,80.00%,100.00%,1,0.2,98.72%,51,85.68%,4.59%,-0.18%,0
168,reverse lunge runner arms,MVP,887,17,3.78%,70.59%,94.12%,1,-0.2941176471,96.28%,182,88.45%,-0.41%,2.18%,0
169,reverse lunge single dumbbell by side,MVP,878,7,4.29%,71.43%,85.71%,1,-0.4285714286,99.77%,70,72.27%,1.71%,0.00%,0
170,reverse lunge single dumbbell overhead,MVP,879,6,6.52%,66.67%,83.33%,1,-0.3333333333,97.25%,60,92.84%,4.38%,0.00%,0
171,reverse lunge single leg,MVP,880,4,14.86%,25.00%,75.00%,0,-2.5,97.72%,68,94.10%,-0.19%,0.00%,0
172,reverse lunge weights racked,MVP,892,8,2.50%,87.50%,87.50%,1,-0.25,98.14%,86,83.42%,0.23%,0.00%,0
173,reverse lunge with curl,List A,885,19,4.39%,78.95%,89.47%,1,-0.3157894737,99.17%,185,86.68%,0.73%,2.16%,1
174,reverse lunge with twist dumbbell,List A,889,7,5.87%,71.43%,85.71%,1,-0.2857142857,98.66%,69,93.37%,1.84%,0.00%,0
175,roll up fingertips to ceiling,List A,1093,17,4.77%,76.47%,88.24%,1,0.4705882353,96.27%,157,89.12%,0.28%,2.42%,0
176,roll up fingertips to toes,List A,1094,19,7.69%,68.42%,89.47%,1,0.1578947368,90.10%,169,87.70%,-5.64%,2.86%,0
177,shoulder tap on knees,List A,1096,16,20.49%,18.75%,50.00%,0,-2.4375,95.46%,198,30.14%,-2.47%,7.59%,0
178,shoulder tap on toes,List A,1098,13,42.91%,7.69%,30.77%,0,-6.615384615,68.97%,184,29.20%,-23.67%,22.05%,0
179,side bend kneeling alternating,List A,1106,13,7.70%,53.85%,84.62%,1,-0.5384615385,98.96%,142,73.93%,-0.34%,6.29%,0
180,side bend kneeling single side,List A,1105,13,10.56%,46.15%,76.92%,0,-0.2307692308,96.39%,243,76.94%,2.36%,0.96%,0
181,single leg deadlift alternating arms by side,MVP,904,18,8.87%,72.22%,88.89%,1,0.5,96.86%,190,94.48%,1.72%,2.14%,0
182,single leg deadlift alternating arms straight out,MVP,905,18,3.24%,72.22%,94.44%,1,0.1111111111,96.51%,197,90.48%,1.23%,0.71%,0
183,single leg deadlift both hands holding one dumbbell,MVP,915,19,1.36%,78.95%,100.00%,1,-0.1052631579,98.34%,294,89.87%,0.28%,0.83%,0
184,single leg deadlift opposite side hand dumbbell,MVP,908,11,9.04%,54.55%,81.82%,1,-0.7272727273,98.55%,117,86.55%,0.80%,1.82%,0
185,single leg deadlift same leg arms by side,MVP,910,20,2.06%,75.00%,100.00%,1,0.25,97.85%,259,94.42%,1.91%,0.73%,0
186,single leg deadlift same side hand dumbbell,MVP,909,12,7.39%,58.33%,91.67%,1,-0.4166666667,92.37%,177,92.24%,-2.95%,7.00%,-1
187,snatch alternating,MVP,1107,20,22.39%,25.00%,35.00%,0,1.6,92.48%,205,76.10%,-2.82%,14.72%,0
188,snatch both arms,MVP,1108,10,20.55%,30.00%,50.00%,0,2,99.04%,98,90.72%,0.05%,19.30%,0
189,snatch hang,MVP,1110,20,11.09%,60.00%,80.00%,0,0.8,94.63%,197,84.05%,-0.84%,8.12%,1
190,snatch power,MVP,1112,19,20.46%,15.79%,47.37%,0,-1.526315789,92.12%,342,81.67%,-1.29%,-0.18%,0
191,snatch single arm,MVP,1109,8,29.89%,25.00%,25.00%,0,2.25,97.49%,88,82.74%,-1.04%,11.85%,0
192,split squat arms by side,MVP,937,11,1.01%,90.91%,100.00%,1,0.09090909091,98.68%,101,46.09%,-0.97%,-1.01%,0
193,split squat arms out laterally,MVP,938,10,1.25%,90.00%,100.00%,1,-0.1,99.90%,97,58.59%,0.95%,0.25%,0
194,split squat arms overhead,MVP,940,11,7.04%,63.64%,81.82%,1,-0.1818181818,99.59%,109,58.97%,0.09%,0.67%,0
195,split squat arms straight out,MVP,939,20,4.52%,30.00%,85.00%,1,0.7,99.19%,395,77.71%,0.51%,0.36%,0
196,split squat hands on hips,MVP,942,16,6.55%,68.75%,93.75%,1,-0.6875,96.85%,194,68.51%,-1.26%,3.88%,0
197,split squat runners arms,MVP,945,19,4.54%,36.84%,78.95%,1,0.6315789474,99.53%,349,64.17%,0.35%,0.64%,0
198,split squat with lateral raise,List A,944,12,17.37%,33.33%,83.33%,0,-0.08333333333,99.78%,120,67.13%,0.35%,4.42%,0
199,squat jumps arms by side,MVP,949,20,4.32%,60.00%,90.00%,1,0,93.50%,235,69.50%,-1.32%,-2.25%,0
200,squat jumps arms by side dumbbell,MVP,955,8,4.80%,62.50%,87.50%,1,-0.25,94.48%,82,80.02%,-1.40%,0.03%,0
201,squat jumps arms straight out,MVP,951,18,11.89%,44.44%,77.78%,0,-1.333333333,93.24%,199,55.40%,3.31%,-2.12%,0
202,squat jumps arms swinging,MVP,952,7,4.31%,57.14%,100.00%,1,-0.1428571429,95.30%,73,84.50%,-1.22%,-1.59%,0
203,squat jumps hands centered,MVP,948,20,3.58%,75.00%,95.00%,1,0.3,95.11%,234,77.43%,-1.24%,-3.00%,0
204,squat jumps hands on hips,MVP,950,20,7.90%,65.00%,85.00%,1,-0.8,87.88%,239,70.74%,-4.23%,0.72%,0
205,squat jumps single dumbbell hanging center,MVP,947,9,12.35%,66.67%,88.89%,0,-1,82.79%,91,84.09%,-1.65%,0.00%,0
206,squat jumps weights racked,MVP,956,8,9.32%,75.00%,75.00%,1,-0.5,92.23%,84,83.26%,-4.63%,3.18%,0
207,squat thrust jump back,List A,1585,10,5.33%,70.00%,90.00%,1,0.6,92.64%,102,36.42%,-4.59%,-0.33%,0
208,squat thrust step back,List A,1586,7,13.53%,71.43%,71.43%,0,1.571428571,90.37%,77,33.23%,-5.98%,9.63%,0
209,standing good morning hands on head,List A,1073,19,6.16%,52.63%,73.68%,1,1.105263158,99.36%,276,60.09%,-0.04%,0.31%,0
210,supinated row alternating with resting arm down,List A,1647,5,29.51%,20.00%,40.00%,0,-0.8,99.35%,56,50.91%,-0.54%,-35.49%,0
211,supinated row alternating with resting arm up,List A,1648,5,11.80%,20.00%,60.00%,0,0,99.90%,68,56.29%,0.00%,7.45%,0
212,supinated row both arms,List A,1649,8,5.68%,87.50%,87.50%,1,0.625,99.95%,87,80.05%,-0.05%,4.55%,0
213,supinated row on knees same time,List A,1650,5,43.73%,0.00%,40.00%,0,0.2,96.55%,54,79.66%,-3.45%,13.73%,0
214,supinated row single arm,List A,1651,10,15.57%,50.00%,60.00%,0,1.4,99.89%,90,51.36%,0.00%,12.46%,0
215,tall kneeling good morning hands on hips,List A,1074,17,0.00%,100.00%,100.00%,1,0,95.83%,166,91.70%,-2.39%,0.00%,0
216,tall kneeling good morning with dumbbell,List A,1075,17,2.94%,94.12%,94.12%,1,-0.2941176471,99.45%,169,83.58%,0.26%,-0.59%,0
217,tall kneeling good mornings hands behind head,List A,1484,3,9.52%,66.67%,66.67%,1,-1.333333333,92.92%,40,23.47%,-7.08%,1.98%,0
218,tricep kickback kneeling alternating with resting arm down,MVP,1261,15,8.68%,60.00%,80.00%,1,-0.8,98.97%,166,64.52%,-0.08%,0.87%,0
219,tricep kickback kneeling alternating with resting arm up,List A,1262,13,23.85%,15.38%,38.46%,0,-2.384615385,99.95%,130,41.55%,0.36%,2.03%,2
