194,split squat arms overhead,MVP,940,11,2.80%,72.73%,100.00%,1,-0.2727272727,99.97%,109,67.42%,0.47%,-3.56%,0.00,0.38%,-4.24%
195,split squat arms straight out,MVP,939,20,4.53%,30.00%,90.00%,1,0.9,99.01%,395,96.10%,0.32%,0.37%,0.00,-0.18%,0.01%
196,split squat hands on hips,MVP,942,16,5.14%,68.75%,93.75%,1,-0.3125,99.23%,194,77.87%,1.12%,2.46%,0.00,2.38%,-1.41%
197,split squat runners arms,MVP,945,19,4.22%,52.63%,73.68%,1,0.4736842105,99.39%,349,91.80%,0.22%,0.32%,0.00,-0.14%,-0.32%
198,split squat with lateral raise,List A,944,12,14.87%,58.33%,75.00%,0,-0.08333333333,99.05%,120,90.38%,-0.38%,1.92%,0.00,-0.73%,-2.50%
199,squat jumps arms by side,MVP,949,20,5.20%,60.00%,85.00%,1,-0.15,96.43%,235,86.76%,1.61%,-1.37%,0.00,2.93%,0.88%
200,squat jumps arms by side dumbbell,MVP,955,8,8.52%,62.50%,87.50%,1,-0.875,96.61%,82,82.99%,0.73%,3.75%,0.00,2.13%,3.72%
201,squat jumps arms straight out,MVP,951,18,8.88%,55.56%,88.89%,1,-0.6111111111,96.27%,199,78.72%,6.34%,-5.13%,0.00,3.03%,-3.01%
202,squat jumps arms swinging,MVP,952,7,7.49%,57.14%,85.71%,1,0.4285714286,97.68%,73,93.15%,1.17%,1.59%,0.00,2.38%,3.18%
203,squat jumps hands centered,MVP,948,20,7.03%,55.00%,95.00%,1,0.55,97.72%,234,92.78%,1.37%,0.45%,0.00,2.61%,3.45%
204,squat jumps hands on hips,MVP,950,20,7.68%,55.00%,90.00%,1,-0.3,93.53%,239,78.37%,1.42%,0.50%,0.00,5.65%,-0.22%
205,squat jumps single dumbbell hanging center,MVP,947,9,11.05%,44.44%,88.89%,0,-0.6666666667,89.32%,91,92.54%,4.88%,-1.30%,0.00,6.53%,-1.30%
206,squat jumps weights racked,MVP,956,8,6.25%,75.00%,87.50%,1,0.375,97.31%,84,94.36%,0.44%,0.11%,0.00,5.08%,-3.07%
207,squat thrust jump back,List A,1585,10,2.67%,80.00%,90.00%,1,0.1,97.85%,102,16.28%,0.62%,-3.00%,0.00,5.21%,-2.66%
208,squat thrust step back,List A,1586,7,2.60%,85.71%,85.71%,1,0.2857142857,96.80%,77,13.25%,0.45%,-1.30%,0.00,6.43%,-10.93%
209,standing good morning hands on head,List A,1073,18,3.82%,50.00%,77.78%,1,0.5,99.41%,260,80.08%,0.02%,-2.03%,-1.00,0.05%,-2.34%
210,supinated row alternating with resting arm down,List A,1647,5,68.08%,20.00%,60.00%,0,1,100.00%,56,82.33%,0.11%,3.08%,0.00,0.65%,38.57%
211,supinated row alternating with resting arm up,List A,1648,5,10.99%,40.00%,60.00%,0,-1.2,99.64%,68,81.59%,-0.26%,6.65%,0.00,-0.26%,-0.81%
212,supinated row both arms,List A,1649,8,0.00%,100.00%,100.00%,1,0,100.00%,87,81.84%,0.00%,-1.14%,0.00,0.05%,-5.68%
213,supinated row on knees same time,List A,1650,5,37.00%,40.00%,40.00%,0,0.6,100.00%,54,86.92%,0.00%,7.00%,0.00,3.45%,-6.73%
214,supinated row single arm,List A,1651,10,9.52%,60.00%,90.00%,1,0.2,99.83%,90,57.01%,-0.06%,6.41%,0.00,-0.06%,-6.05%
215,tall kneeling good morning hands on hips,List A,1074,17,0.00%,100.00%,100.00%,1,0,98.87%,166,94.02%,0.65%,0.00%,0.00,3.04%,0.00%
216,tall kneeling good morning with dumbbell,List A,1075,17,2.94%,94.12%,94.12%,1,-0.2941176471,99.84%,169,86.50%,0.65%,-0.59%,0.00,0.39%,0.00%
217,tall kneeling good mornings hands behind head,List A,1484,3,0.00%,100.00%,100.00%,1,0,100.00%,40,1.58%,0.00%,-7.54%,0.00,7.08%,-9.52%
218,tricep kickback kneeling alternating with resting arm down,MVP,1261,15,13.89%,60.00%,73.33%,0,-1.533333333,99.98%,166,70.94%,0.92%,6.07%,0.00,1.01%,5.21%
219,tricep kickback kneeling alternating with resting arm up,List A,1262,11,24.55%,27.27%,36.36%,0,-2.454545455,99.94%,110,43.41%,0.35%,2.73%,0.00,-0.01%,0.70%
220,tricep kickback kneeling both arms,MVP,1260,17,1.71%,88.24%,94.12%,1,-0.1764705882,98.36%,170,72.10%,0.70%,-0.53%,0.00,-1.06%,0.00%
221,tricep kickback standing alternating with resting arm down,MVP,1270,12,16.13%,33.33%,66.67%,0,-1.583333333,100.00%,118,82.63%,0.00%,6.04%,0.00,0.07%,7.61%
222,tricep kickback standing alternating with resting arm up,List A,1269,10,22.25%,10.00%,50.00%,0,-1.8,99.92%,99,76.15%,-0.08%,7.00%,0.00,0.08%,3.18%
223,tricep kickback standing both arms,MVP,1267,16,5.14%,75.00%,87.50%,1,-0.3125,99.74%,181,75.61%,-0.16%,2.50%,1.00,0.14%,-1.37%
224,tricep kickback standing single arm with resting arm down,MVP,1268,20,11.46%,45.00%,75.00%,0,-0.85,99.93%,393,82.05%,0.08%,4.00%,0.00,0.30%,2.21%
225,tuck jump consecutive,List A,1076,17,54.68%,5.88%,11.76%,0,-11.64705882,90.29%,360,27.83%,-1.56%,5.16%,0.00,34.28%,-11.58%
226,tuck jump with pause,List A,1077,17,26.63%,11.76%,35.29%,0,-2.529411765,87.02%,192,49.41%,-1.82%,9.09%,0.00,40.68%,-20.99%
227,tuck up arms overhead,MVP,1124,18,15.17%,61.11%,77.78%,0,-0.2777777778,83.87%,160,88.72%,1.81%,0.01%,0.00,1.77%,0.36%
228,tuck up assisted,MVP,1730,11,4.08%,54.55%,100.00%,1,-0.4545454545,97.33%,121,82.86%,-0.56%,1.74%,0.00,0.02%,-0.74%
229,tuck up both legs arms by side,MVP,1123,5,4.00%,80.00%,80.00%,1,0.4,97.94%,51,81.62%,-1.32%,4.00%,0.00,-0.83%,2.18%
230,tuck up hands grab feet,MVP,1126,16,5.25%,68.75%,87.50%,1,0.5,95.13%,149,92.03%,0.87%,2.95%,0.00,0.30%,-0.83%
231,tuck up hands grab knees,MVP,1125,19,5.48%,57.89%,94.74%,1,0.3684210526,97.34%,174,82.83%,0.82%,-0.65%,0.00,2.15%,0.07%
232,turkish getup alternating,List A,1127,10,97.50%,0.00%,0.00%,0,-5.1,99.45%,52,1.85%,0.34%,96.39%,0.00,1.79%,96.39%
233,turkish getup same side,List A,1128,12,94.09%,0.00%,0.00%,0,-5.916666667,95.68%,76,16.28%,0.40%,87.42%,0.00,1.84%,88.26%
234,v up arms by side,MVP,1129,14,1.36%,85.71%,100.00%,1,-0.1428571429,98.30%,138,70.99%,1.64%,-0.71%,0.00,2.59%,-2.80%
235,v up arms overhead,MVP,1130,20,2.88%,85.00%,95.00%,1,-0.2,96.90%,182,72.90%,1.19%,-1.99%,0.00,2.24%,-1.90%
236,v up assisted,MVP,1131,15,5.70%,66.67%,80.00%,1,-0.4,99.40%,153,58.48%,0.18%,0.75%,0.00,1.78%,-1.78%
237,wide grip bent over row alternating with resting arm down,MVP,1721,6,5.36%,50.00%,83.33%,1,0.3333333333,95.14%,76,79.08%,-0.94%,-5.56%,0.00,-4.86%,-5.16%
238,wide grip bent over row alternating with resting arm up,List A,1718,8,21.06%,25.00%,37.50%,0,-3,100.00%,118,56.58%,0.06%,12.40%,0.00,0.10%,-3.96%
239,wide grip bent over row both arms,MVP,1719,6,0.00%,100.00%,100.00%,1,0,100.00%,67,97.23%,0.00%,0.00%,0.00,0.06%,0.00%
240,wide grip chest press hook lying both arms,MVP,1523,4,2.08%,75.00%,100.00%,1,0.25,99.65%,51,83.90%,-0.26%,0.00%,0.00,0.10%,-1.93%
241,wide grip chest press table top both arms,MVP,1527,4,6.25%,50.00%,75.00%,1,0.75,100.00%,50,33.07%,0.00%,-5.77%,0.00,0.72%,2.24%
242,wood chop kneeling alternating,MVP,1136,10,2.00%,80.00%,100.00%,1,0.2,100.00%,144,98.78%,0.96%,1.00%,0.00,0.00%,-3.89%
243,wood chop kneeling single side,MVP,1133,5,1.05%,80.00%,100.00%,1,0.2,99.94%,100,98.75%,0.00%,0.00%,0.00,0.19%,-2.00%
244,wood chop one knee,MVP,1140,12,6.41%,50.00%,83.33%,1,-0.3333333333,97.48%,243,97.35%,0.58%,0.02%,0.00,-1.27%,-3.41%
245,wood chop sitting alternating,MVP,1135,11,9.32%,63.64%,81.82%,1,0.2727272727,100.00%,144,98.18%,0.04%,0.76%,0.00,0.00%,-3.76%
246,wood chop sitting single side,MVP,1134,5,2.22%,80.00%,80.00%,1,0.4,99.28%,99,98.28%,-0.72%,0.00%,0.00,-0.72%,-0.89%
247,wood chop standing alternating,MVP,1137,10,2.94%,70.00%,90.00%,1,0,99.84%,134,98.69%,-0.10%,0.00%,0.00,-0.13%,-5.09%
248,wood chop standing single side,MVP,1315,9,1.20%,77.78%,100.00%,1,0,99.62%,154,98.54%,0.09%,0.00%,0.00,1.46%,-2.41%
249,zottman curl balancing alternating with resting arm down,MVP,1291,8,2.50%,75.00%,100.00%,1,0,99.29%,82,97.21%,1.79%,2.50%,0.00,0.38%,2.50%
250,zottman curl kneeling both arms,MVP,1279,13,0.85%,92.31%,100.00%,1,0.07692307692,99.09%,131,97.43%,-0.11%,-0.77%,0.00,1.17%,-4.58%
251,zottman curl standing alternating with resting arm down,MVP,1287,8,5.00%,87.50%,87.50%,1,-0.25,99.10%,77,95.77%,0.59%,5.00%,0.00,-0.56%,5.00%
252,zottman curl standing alternating with resting arm up,List A,1281,8,18.13%,0.00%,75.00%,0,1.75,100.00%,78,97.75%,0.04%,3.75%,0.00,0.00%,9.38%
253,zottman curl standing both arms,MVP,1282,12,5.83%,83.33%,83.33%,1,-0.5833333333,98.02%,110,99.14%,0.79%,0.00%,0.00,0.75%,0.00%
,,,,,,,,,,,,,,,,,
,Avg,,,,8.26%,64.03%,84.90%,,,97.74%,,83.72%,0.55%,1.80%,4.72%,2.04%,-0.35%